{
  "tenant_id": "tenant-demo",
  "company_id": "mixed-controls",
  "name": "ООО Контур",
  "description": "Компания производит датчики, разрабатывает ПО и импортирует керамические компоненты. Зависит от импортных микросхем.",
  "provenance": "user-provided description",
  "as_of": "2026-10-25T12:00:00Z",
  "data_classification": "synthetic",
  "statement_status": "unconfirmed"
}
